  <!ELEMENT students (student*)>
  <!ELEMENT student (name,rollno,marks)>
  <!ELEMENT name (#PCDATA)>
  <!ELEMENT rollno (#PCDATA)>
  <!ELEMENT marks (#PCDATA)>
  <!ENTITY mark "0">
  <!ATTLIST student id CDATA #IMPLIED>